{
  "dispatchId": "11111111-1111-4111-8111-111111111111",
  "sessionId": "22222222-2222-4222-8222-222222222222",
  "workspaceIdentity": "remote:ax42-01:work-session:22222222-2222-4222-8222-222222222222",
  "workloadClass": "NORMAL",
  "leaseGeneration": 1,
  "workload": {
    "kind": "project-codex-v2",
    "projectId": "atenea",
    "repository": "https://github.com/jlnieto/atenea.git",
    "branch": "feature/actualizar-conversacion-en-web",
    "commit": "1111111111111111111111111111111111111111",
    "manifestSha256": "2222222222222222222222222222222222222222222222222222222222222222",
    "instructionBundleRevision": "atenea-reviewed-instruction-bundle-v1",
    "instructionBundleSha256": "3333333333333333333333333333333333333333333333333333333333333333",
    "platformInstructionSha256": "4444444444444444444444444444444444444444444444444444444444444444",
    "projectInstructionPath": "AGENTS.md",
    "projectInstructionSha256": "5555555555555555555555555555555555555555555555555555555555555555",
    "modelId": "gpt-5.6-sol",
    "reasoningEffort": "high",
    "catalogRevision": "125b9437e38f83e04cb10996fc70d3ab44c32082009b8e897cb08bb340b13187",
    "codexVersion": "0.145.0",
    "message": "Inspect the accepted synthetic contract fixture.",
    "threadId": null
  }
}
